Category,Positive Indicator,Strategic Impact
Category,Positive Indicator,Strategic Impact
---,---,---
Innovation,Accenture managing director highlights the importance of AI prompt engineering and critical thinking in maximizing AI's value in finance.,"Positions Accenture as a leader in advising on and implementing AI solutions, attracting clients seeking to leverage AI for improved efficiency and decision-making.  This enhances Accenture's competitive advantage and revenue streams."
Innovation,"Accenture emphasizes the importance of understanding AI frameworks in finance to accelerate prototyping, experimentation, and improvement.",Demonstrates Accenture's proactive approach to innovation and its commitment to staying ahead of the curve in the rapidly evolving field of AI in finance. This strengthens its reputation as a thought leader and attracts top talent.
Operational Excellence,Accenture is driving experimentation within its organization to develop AI skills in new hires.,"Shows a commitment to continuous improvement and adaptation to new technologies, which leads to greater efficiency and improved service delivery for clients.  This enhances employee skills and client satisfaction."
Market Position,Accenture is mentioned as a key player in a Fortune article discussing the growing importance of AI prompt writing skills in finance.,"Increases Accenture's visibility and brand recognition within the finance industry, positioning it as a trusted advisor on AI adoption. This can attract new clients and strengthen existing relationships."
